{
  "daily_cap_usd": 0.1,
  "total_cap_usd": 0.1,
  "schema_version": "agent-router-profile.v1",
  "extension_owner": "AES",
  "profile_id": "colleague",
  "mode": "manual",
  "allowed_rule_ids": [
    "root-cause-over-symptom",
    "integrate-before-build",
    "plan-nontrivial-work",
    "commit-tags",
    "observable-fast-work",
    "md-file-cap",
    "loud-failures-reach-an-agent",
    "read-the-trace",
    "situation-declared-checklists",
    "ui-tooltips-default",
    "recommendations-not-question-lists",
    "cross-owner-policy-override-protocol",
    "jev-m1-merge-reads-exit-code",
    "loop-378",
    "loop-379",
    "loop-384",
    "loop-385",
    "loop-386",
    "loop-387",
    "loop-388",
    "loop-389",
    "loop-390",
    "loop-391",
    "loop-392",
    "loop-405",
    "loop-406",
    "loop-407",
    "loop-408",
    "loop-411",
    "loop-412",
    "loop-413",
    "loop-414",
    "loop-415"
  ],
  "required_rule_ids": [
    "root-cause-over-symptom",
    "integrate-before-build",
    "plan-nontrivial-work",
    "commit-tags",
    "observable-fast-work",
    "md-file-cap",
    "loud-failures-reach-an-agent",
    "read-the-trace",
    "situation-declared-checklists",
    "ui-tooltips-default",
    "recommendations-not-question-lists",
    "cross-owner-policy-override-protocol",
    "jev-m1-merge-reads-exit-code",
    "loop-378",
    "loop-379",
    "loop-384",
    "loop-385",
    "loop-386",
    "loop-387",
    "loop-388",
    "loop-389",
    "loop-390",
    "loop-391",
    "loop-392",
    "loop-405",
    "loop-406",
    "loop-407",
    "loop-408",
    "loop-411",
    "loop-412",
    "loop-413",
    "loop-414",
    "loop-415"
  ],
  "specialist_aliases": {
    "source-checker": "development-investigator"
  },
  "allowed_models": [],
  "allowed_efforts": [],
  "native_field_maps": {
    "codex": {
      "subagent": "agent_type"
    }
  },
  "provider_route": "native/codex-subscription",
  "workspace_env": "WORKSPACE_ROOT",
  "log_root_env": "AGENT_ROUTER_OUT"
}
